<?xml version="1.0"?>


<!DOCTYPE rttconfig SYSTEM "http://www.hep.ucl.ac.uk/atlas/AtlasTesting/DTD/RTT.dtd"> 

<!-- <!DOCTYPE rttconfig SYSTEM "file:///Users/peter/RTTtop/DTD/RTT.dtd"> -->

<rttconfig>
   <mode>PBS</mode>
   <release>11.3.0</release>
   <refRelease>11.0.0</refRelease>
   <build>opt</build>
   <branch>N.X.0</branch>
   <runType>
      <releaseRun/>
   </runType>
   <workBasePath>TESTSUITESCRATCH/Work</workBasePath>
   <resultsBasePath>TESTSUITESCRATCH/Results</resultsBasePath>
   <site>CERN</site>
   <dataSetCatalog>TESTSUITESCRATCH/xml/rttUnitTestDataSetCatalog.xml</dataSetCatalog>
   <jobGroupConfig>TESTSUITESCRATCH/xml/rttUnitTestTopLevelJobGroup.xml</jobGroupConfig>
   <refDB>
      <file>TESTSUITESCRATCH/rttUnitTestRefFile.db</file>
      <enable>1</enable>
   </refDB>
   <moniDB>
      <file>TESTSUITESCRATCH/rttUnitTestMoniFile.db</file>
      <enable>1</enable>
   </moniDB>


   <confFileSrc>
      <rttProvides>
        <packageConfFile>
           <package>Simulation/Atlfast/TestAtlfast</package>
           <pathToFile>TESTSUITESCRATCH/xml/TestAtlfast_TestConfiguration.xml</pathToFile>

           <cmtpath>/afs/cern.ch/atlas/software/builds/AtlasReconstruction/1.3.0</cmtpath>
           <version>TestAtlfast-00-00-61</version>
           <installArea>/afs/cern.ch/atlas/software/builds/AtlasReconstruction/1.3.0/InstallArea</installArea>

           <shareArea>/afs/cern.ch/atlas/software/builds/AtlasReconstruction/1.3.0/InstallArea/share</shareArea>
        </packageConfFile>


        <packageConfFile>
           <package>Tools/RunTimeTester</package>
           <pathToFile>TESTSUITESCRATCH/xml/RunTimeTester_TestConfiguration.xml</pathToFile>

           <cmtpath>/afs/cern.ch/atlas/software/builds/AtlasCore/1.3.0</cmtpath>
           <version>RunTimeTester-00-00-82</version>
           <installArea>/afs/cern.ch/atlas/software/builds/AtlasCore/1.3.0/InstallArea</installArea>

           <shareArea>/afs/cern.ch/atlas/software/builds/AtlasCore/1.3.0/InstallArea/share</shareArea>
        </packageConfFile>


      </rttProvides>
      <installedConfFiles/>
   </confFileSrc>

   <!-- <packageAccept>HelloWorld</packageAccept> -->
   <!-- <packageVeto>TestAtlfast</packageVeto> -->
<!--   <testMode>NoNewRunDirs</testMode> -->
   <maxTime>
      <hours>1</hours>
   </maxTime>
   <!-- <rttKitTest/> -->
   <releaseType>project</releaseType>
</rttconfig>
