<?xml version="1.0"?>


<!DOCTYPE rttconfig SYSTEM "http://www.hep.ucl.ac.uk/atlas/AtlasTesting/DTD/RTT.dtd">


<!-- <!DOCTYPE rttconfig SYSTEM "RTT.dtd"> -->
<rttconfig>
   <mode>PBS</mode>
   <release>11.0.0</release>
   <refRelease>11.0.0</refRelease>
   <build>opt</build>
   <branch>N.X.0</branch>
   <workBasePath>TESTSUITESCRATCH/Work</workBasePath>
   <resultsBasePath>TESTSUITESCRATCH/Results</resultsBasePath>
   <site>CERN</site>
   <dataSetCatalog>TESTSUITESCRATCH/xml/rttUnitTestDataSetCatalog.xml</dataSetCatalog>
   <jobGroupConfig>TESTSUITESCRATCH/xml/rttUnitTestTopLevelJobGroup.xml</jobGroupConfig>
   <refDB>
      <file>TESTSUITESCRATCH/rttUnitTestRefFile.db</file>
      <enable>1</enable>
   </refDB>


   <confFileSrc>
      <rttProvides>
        <!-- <packageConfFile> -->
           <!-- <package>HelloWorld</package> -->
           <!-- <pathToFile>/local_disk/sherwood/RTT/HelloWorld_TestConfiguration.xml</pathToFile> -->
        <!-- </packageConfFile> -->
        <packageConfFile>
           <package>Simulation/Atlfast/TestAtlfast</package>
           <!-- <pathToFile>/afs/cern.ch/atlas/software/dist/11.0.0/Simulation/Atlfast/TestAtlfast/TestAtlfast-00-00-55/test/TestAtlfast_TestConfiguration.xml</pathToFile> -->
           <pathToFile>TESTSUITESCRATCH/xml/TestAtlfast_TestConfiguration.xml</pathToFile>
           <cmtdir>/afs/cern.ch/atlas/software/dist/11.0.0/Simulation/Atlfast/TestAtlfast/TestAtlfast-00-00-55/</cmtdir>
        </packageConfFile>
      </rttProvides>
      <!-- <localConfFiles> -->
         <!-- <package>Simulation/Atlfast/TestAtlfast</package> -->
      <!-- </localConfFiles> -->
      <!-- <installedConfFiles/> -->
   </confFileSrc>

   <!-- <packageAccept>HelloWorld</packageAccept> -->
   <!-- <packageVeto>TestAtlfast</packageVeto> -->
<!--   <testMode>NoNewRunDirs</testMode> -->
   <maxTime>
      <hours>1</hours>
   </maxTime>
   <!-- <rttKitTest/> -->
</rttconfig>
